{
  "name": "warm_robot",
  "ply_file": "warm_robot.ply",
  "scale": 0.5,
  "bones": [
    { "id": "torso", "parent": null, "joint": [16, 3, 16] },
    { "id": "head", "parent": "torso", "joint": [16, 7, 16] },
    { "id": "left_arm", "parent": "torso", "joint": [13, 6, 16] },
    { "id": "right_arm", "parent": "torso", "joint": [19, 6, 16] },
    { "id": "left_leg", "parent": "torso", "joint": [14, 3, 16] },
    { "id": "right_leg", "parent": "torso", "joint": [18, 3, 16] },
    { "id": "antenna", "parent": "head", "joint": [16, 10, 16] }
  ],
  "poses": {
    "rest": {
      "torso": [0, 0, 0], "head": [0, 0, 0], "left_arm": [0, 0, -80],
      "right_arm": [0, 0, 80], "left_leg": [0, 0, 0], "right_leg": [0, 0, 0], "antenna": [0, 0, 0]
    },
    "breathe": {
      "torso": [0, 0, 0], "head": [3, 0, 0], "left_arm": [0, 0, -82],
      "right_arm": [0, 0, 82], "antenna": [5, 0, 0]
    },
    "walk_1": {
      "torso": [5, 0, 0], "left_arm": [30, 0, -80], "right_arm": [-30, 0, 80],
      "left_leg": [-25, 0, 0], "right_leg": [25, 0, 0]
    },
    "walk_2": {
      "torso": [5, 0, 0], "left_arm": [-30, 0, -80], "right_arm": [30, 0, 80],
      "left_leg": [25, 0, 0], "right_leg": [-25, 0, 0]
    }
  },
  "animations": {
    "idle": {
      "duration": 2.0, "looping": true,
      "keyframes": [
        { "time": 0.0, "pose": "rest" },
        { "time": 1.0, "pose": "breathe" },
        { "time": 2.0, "pose": "rest" }
      ]
    },
    "walk": {
      "duration": 0.6, "looping": true,
      "keyframes": [
        { "time": 0.0, "pose": "walk_1" },
        { "time": 0.3, "pose": "walk_2" },
        { "time": 0.6, "pose": "walk_1" }
      ]
    }
  }
}
