{
  "name": "snes_hero",
  "ply_file": "snes_hero.gsvx",
  "scale": 1.0,
  "bones": [
    {
      "id": "torso",
      "parent": null,
      "joint": [
        0.0,
        -0.9,
        0.0
      ]
    },
    {
      "id": "head",
      "parent": "torso",
      "joint": [
        0.0,
        0.9,
        0.0
      ]
    },
    {
      "id": "left_arm",
      "parent": "torso",
      "joint": [
        -1.35,
        0.45,
        0.0
      ]
    },
    {
      "id": "right_arm",
      "parent": "torso",
      "joint": [
        1.35,
        0.45,
        0.0
      ]
    },
    {
      "id": "left_leg",
      "parent": "torso",
      "joint": [
        -0.45,
        -2.7,
        0.0
      ]
    },
    {
      "id": "right_leg",
      "parent": "torso",
      "joint": [
        0.45,
        -2.7,
        0.0
      ]
    },
    {
      "id": "cape",
      "parent": "torso",
      "joint": [
        0.0,
        0.45,
        0.9
      ]
    }
  ],
  "poses": {
    "rest": {},
    "breathe": {
      "left_arm": [
        0,
        0,
        -2
      ],
      "right_arm": [
        0,
        0,
        2
      ],
      "cape": [
        2,
        0,
        0
      ]
    },
    "walk_1": {
      "left_arm": [
        8,
        0,
        0
      ],
      "right_arm": [
        -8,
        0,
        0
      ],
      "left_leg": [
        -6,
        0,
        0
      ],
      "right_leg": [
        6,
        0,
        0
      ],
      "cape": [
        -3,
        0,
        0
      ]
    },
    "walk_2": {
      "left_arm": [
        -8,
        0,
        0
      ],
      "right_arm": [
        8,
        0,
        0
      ],
      "left_leg": [
        6,
        0,
        0
      ],
      "right_leg": [
        -6,
        0,
        0
      ],
      "cape": [
        3,
        0,
        0
      ]
    },
    "jump_up": {
      "left_arm": [
        -30,
        0,
        -20
      ],
      "right_arm": [
        -30,
        0,
        20
      ],
      "left_leg": [
        15,
        0,
        0
      ],
      "right_leg": [
        15,
        0,
        0
      ],
      "cape": [
        -8,
        0,
        0
      ]
    },
    "jump_land": {
      "left_leg": [
        20,
        0,
        3
      ],
      "right_leg": [
        20,
        0,
        -3
      ],
      "left_arm": [
        8,
        0,
        -10
      ],
      "right_arm": [
        8,
        0,
        10
      ],
      "torso": [
        8,
        0,
        0
      ],
      "cape": [
        5,
        0,
        0
      ]
    }
  },
  "animations": {
    "idle": {
      "duration": 1.0,
      "looping": true,
      "keyframes": [
        {
          "time": 0,
          "pose": "rest"
        },
        {
          "time": 0.5,
          "pose": "breathe"
        },
        {
          "time": 1.0,
          "pose": "rest"
        }
      ]
    },
    "walk": {
      "duration": 0.6,
      "looping": true,
      "keyframes": [
        {
          "time": 0,
          "pose": "walk_1"
        },
        {
          "time": 0.15,
          "pose": "rest"
        },
        {
          "time": 0.3,
          "pose": "walk_2"
        },
        {
          "time": 0.45,
          "pose": "rest"
        },
        {
          "time": 0.6,
          "pose": "walk_1"
        }
      ]
    },
    "jump": {
      "duration": 0.8,
      "looping": false,
      "keyframes": [
        {
          "time": 0,
          "pose": "rest"
        },
        {
          "time": 0.1,
          "pose": "jump_land"
        },
        {
          "time": 0.3,
          "pose": "jump_up"
        },
        {
          "time": 0.55,
          "pose": "jump_land"
        },
        {
          "time": 0.8,
          "pose": "rest"
        }
      ]
    }
  }
}